{"schema_version":"1.0","query_id":"LS-STATUS-QUERY-FIXTURE-404","sku_id":"SKU-FIXTURE-001","lookup_status":"NOT_FOUND","operation_status":"NOT_AVAILABLE","request_id":null,"operation_id":null,"latest_receipt_ref":null,"latest_receipt_sha256":null,"replayed_from_storage":true,"mutation_authority":"NONE","evaluated_at":"2026-10-04T12:30:01Z"}
