{"schema_version":"1.0","query_id":"LS-STATUS-QUERY-FIXTURE-001","sku_id":"SKU-FIXTURE-001","lookup_status":"FOUND","operation_status":"COMPLETED","request_id":"LS-PSP-REQ-FIXTURE-RECREATE-001","operation_id":"OP-FIXTURE-RECREATE-001","latest_receipt_ref":"LS-PSP-RECEIPT-FIXTURE-COMMITTED-001","latest_receipt_sha256":"bbbbbbbbbbbbbbbbbbbbbbbbbbbbbbbbbbbbbbbbbbbbbbbbbbbbbbbbbbbbbbbb","replayed_from_storage":true,"mutation_authority":"NONE","evaluated_at":"2026-10-04T12:30:01Z"}
